,Title,Review Text,aspect-opinion
54,Great summer fabric!,"I really wanted this to work. alas, it had a strange fit for me. the straps would not stay up, and it had a weird fit under the breast. it worked standing up, but the minute i sat down it fell off my shoulders. the fabric was beautiful! and i loved that it had pockets.","['straps- weird', 'fabric- beautiful']"
71,Sweet flattering dress,"I love cute summer dresses and this one, especially because it is made out of linen, is unique. it is very well-made with a design that is quite flattering. i am 5 foot 6 and a little curvy with a 38 c bust and i got a size 10. it fits well although it is difficult to zip up because the material has no give. the perfect dress to wear to italy or france! now i just have to book my tickets!","['one- cute', 'material-well difficult']"
374,Great sweater dress!,"Nice fit and flare style, not clingy at all. i got the grey color, petite large, fits perfect. will wear with tights/boots or booties. lots of color options to accessorize with.",['petite- grey']
377,"Cute, but cheap","When i first opened this dress and tried it on i thought it was adorable. it is very flattering on my hourglass figure and hides my recent baby weight. the problem is the hem. it was already rolling up when i took it out of the package, and i should have noticed and returned it, but i figured the problem would be easily solved by a good ironing. well, it wasn't, and it gets worse every time i wash the dress. it's like the hem isn't constructed properly.",['problem- hem']
381,Super cute and flattering too,"I love this sweater dress and get compliments every time i wear it.. i bought the navy in size xs. the pattern and colors are just fun and youthful, although you don't have to be young to look good in this dress. the dress is fitted, but the skirt flares, making it flattering if you have hips like me. the material is not too heavy so you can wear this 3 seasons fall, winter, spring. as other reviews have mentioned the dress is short. i am 5'9"" so it does hit well above my knees. this isn't an is","['pattern-just fun', 'skirt- flattering', 'material-too heavy', 'reviews- other', 'dress- short']"
383,Fun dress,Extremely flattering. an easy dress to wear - good choice for both day and evening,[]
392,Fun mix of colors in the grey version,"I ordered this dress in size xl in the grey/red/yellow combination. i love everything about this dress. it's comfortable. the colors are cheerful. the proportions of where the stripes are placed works. but, i have to return this dress. it's too short for what i'm comfortable wearing. i saw from the photos that this comes mid-thigh on the taller models. i hoped that would mean it would be more knee-length for me. unfortunately, it's just too short and i'd feel self-conscious. i don't want to deal",['colors- cheerful']
397,For the shorter girls,"I really wanted to love this dress, but it was so short! i'm only 5'6"" so i don't consider myself really tall, but the dress only came a couple of inches lower than my butt! way too short for me. my husband asked if it was a shirt or dress haha. but i think this would look adorable on someone a few inches shorter. or someone younger who can pull of a short shirt :)",['dress-really tall']
402,"Cute concept, fits weird",The fun colors drew me to this but it sure fit weird. the top was fine but it became a bit tent-like in the waist. the material doesn't feel great either.,"['colors- fun', 'top- fine', 'material- great']"
405,Love this dress,Very comfortable and versatile. got lots of compliments.,[]
408,"So cute, but weird fit","This dress is really cute in person. however, it did not fit me like it does the model in the pic at all. first of all i'm 5 feet 1 and it was wayyy too short on me. i didn't have the petit on either-- i had the regular xs. it just hits a couple of inches too short for me. i am 50. it would be adorable if i were more comfortable in shorter dresses. i wear short things a lot, but this was just too high on me. it was probably a good 8 inches above my knee. also it flared too dramatically at the wa",['dress-really cute']
410,"Comfy, cute, and colorful.","This knit dress is very comfortable. i liked the various colors used in the stripes. my only issue with it, is that the skirt of the dress flares out oddly and is quite short. in my opinion, this dress, with its sturdy fabric and long sleeves, would appear more proportional with a longer skirt. skirt length, along with horizontal stripes just did not work for me. regrettably, i sent it back.","['dress-very comfortable', 'issue- only', 'skirt-quite short', 'dress- sturdy', 'length- horizontal']"
411,Best fitting dress,Love love this dress. fits so great. i normally wouldn't have picked this dress. more preppy than my normal style. fits amazing. my hubby has complimented me more on this dress than anything else i've ever owned. the fit & flare style is super flattering i felt it fit tts.,"['hubby-more else', 'style-super flattering']"
414,Cute but skip the petite unless you are very short,"Beautiful colors, especially the pink. i am 5'3"" and about 124 lb. i got the small petite but am thinking of exchanging it for the regular xs. not only is it short hem-wise, which i don't really mind, but it is short in the waist. very pretty and good fabric.",[]
424,Cute and fun!,The horizontal lines on the skirt and top gives the wearer and very nice dress. i am short so i got the 6 petite and it fits perfectly. the fabric is thick and stretchy.,"['lines- horizontal', 'fabric- thick']"
427,Great dress or tunic,"The colors are more vibrant than the photo indicates. indeed, though, the dress is very short and does pair well with leggings and boots.

i like that the dress highlights my hour glass figure, but with a generous nod to my curves with the accommodating skater skirt.

love it! will be easy to wear casually and work appropriate, too. the sale price was a huge bonus.","['colors-more vibrant', 'dress-very short', 'dress- generous', 'price- huge']"
436,Flattering,"This dress is comfortable as well as flattering, which does not happen very often!
looks good with navy tights too!",['dress- comfortable']
437,Cute dress,"Based on some reviews i decided to get the regular xs, even tho i am an xs petite (5'2, 107 lb, 32c) i found the fit to be flattering -- fitted enough but not too loose or tight. the length is perfect and work appropriate, and the material has some weight to it. the grey one is colorful and cute. the only problem is the bagginess of the arms -- very unflattering. if i push the sleeves up, it hides the bagginess a little, but i would like to have the option to wear the dress with long sleeves., s","['length- perfect', 'material- appropriate', 'one- grey', 'problem- only']"
440,Love this dress!,"I went to my local store and they only had the blue dress in stock, i had seen it online and i didn't expect to like the blue one. i tried it on anyway, and it was adorable! i struggled to choose, but i ordered the gray one at the store and they shipped it directly to me. it arrived quickly and i love it!",[]
444,Not a fan - childish,"I thought that it looked like it belonged on a 15 year-old. i can almost see why they styled the model in what looks like ankle socks....ready for cheerleading. for reference it fits true to size, but is very short. i am 5'2"" and tried on a regular small - it was at least 5 inches above my knee.",[]
484,Gorgeous quality knit,"I was lucky enough to get a hold of this intarsia sweater dress after the sale and i wish i had purchased this the first time round. it is absolutely stunning, flattering, comfortable and unique! i am 5'3"" and the regular hem fit me just fine at the ankles. i think this dress runs both tts to a bit large so i would size down if your small framed and stay your usual if your busty or broad shouldered. perfectly complements my taupe booties that i already owned and a my taupe maxi sweater that has","['hem-absolutely regular', 'dress- large']"
660,Flattering,"Very slimming, lovely dress.
a nice addition to your fall/ winter wardrobe.
the embroidery is lovely, fabric soft and comfortable. sized perfectly. 
so happy with this beautiful black dress!!!",['embroidery- lovely']
671,Nice casual tunic-dress,"Comfortable,t eh fabric is very soft. the embroidery adds a little to the otherwise plain black tunic. lace up neck on trend too. 

i ordered the xxs p, as it is likely loose... that was just fine for me, xs p would have been not as flattering. theo nly problem with that is the sleeves then became a little more snug (workout arms). not too snug that i can't wear the dress, but decided not to keep it only because there are way too many things i like at retailer! (and have to pick). in my wish lis","['fabric- Comfortable', 'embroidery- little', 'p-just fine', 'problem- sleeves', 'way-too snug', 'things-too many']"
684,I'm in love!,"I love this shirtdress. the lace and collar design pops off the black. super comfortable and love that it has pockets! a keeper, this one not going back ever. i am 5'9 and 140 lbs and the 6 fits perfect. the length comes above my knee, so most likely i will be wearing tights or skinny's underneath.","['one-super comfortable', 'fits- perfect', 'length-most likely']"
688,Great dress!!,"I am 5'4"" 140 pounds and ordered the 8 petite. it fits perfectly and is very flattering. the embroidery and lace up neckline thing is really awesome. it gives the dress some character... i am also a fan of the roll-up sleeves. i wish it came in other colors because i would certainly order more than one. the one and only potentially negative aspect, and i say potential because i'm not sure if its an issue or not as i haven't worn/washed it yet is it appears to be something that i may have to iron","['thing-really awesome', 'one-potentially negative', 'issue- sure']"
692,The perfect fall dress,"Ordered this dress online and wasn't sure about the criss-cross neckline feature but i love it! it's absolutely adorable and unbelievably comfortable. the fabric is very soft and lays nicely without feeling too ""baggy"" or frumpy. the embroidery is beautiful. i'm wearing it to a fall event in october and pairing it with my favorite cowboy boots, but it would also look great with flats, heels or booties. totally in love with this dress!","['fabric-very soft', 'embroidery- beautiful']"
693,"Adorable, comfortable, flattering; this has it all","I was not shopping for a dress and somehow came home with this. in person the material and embroidery are just so stunning that i found myself picking it up. i was sold after trying it on. the material is very soft, both feels and looks extremely high quality. and for a basic shirtdress, it is amazingly flattering. follows curves without clinging to them. i'm 5'4"", 123 lbs, usually wear a small in tops/dresses & purchased the size 4, which fit perfectly. i'm slightly chesty (34d) so sometimes ha","['material-so stunning', 'material-very soft']"
700,Could be a bit shorter,"Great material. a bit loose in the middle / lower half. doesn't belt well. it could be 3"" shorter, considering alterations. i'm 5'7"" the model is 5'10"", so yeah 3"" shorter would be cute!","[""model- '""]"
1280,Love it!,"Great dress! wish it came it more colors, would like to buy another one. i am 5'5"",125, size small is perfect. unlike one of the previous reviewers, i do not think it is too clingy. maybe she needed to size up.very versital, cute with a jean jacket, or long lightweight scarf, booties, or sandals! .",['size- small']
1282,Lovely gem!!,"I've passed this dress by a number of times online, but ordered it on a whim on the mothers day promo. based on the reviews, i ordered my regular size, medium. it fit perfectly. i do think the cut is on the trim side, but it isn't tight or fitted. i probably couldn't eat a big meal in this though as it would probably show in this dress. the fabric is buttery soft! the button placket down the front is very clean and lays flat. there are two side pleats that are a different fabric and are ever so","['cut- tight', 'fabric- buttery', 'placket- soft', 'pleats- different']"
1289,"Wanted to love, but...","Tried on this maxi dress recently, hoping i would have a new dress to enjoy but the frabic is just too thin. so sad :(. unfortunately it shows every lump and bump and even wearing spanx while trying on it still showed too much. a full length slip would help but i decided to put it back.","['frabic-recently new', 'slip- full']"
1297,Elegant comfort,"I bought this dress with my birthday gift and i do not regret it! it's so soft and feels like pure comfort but the details, little metal buttons down the front, the vent pleats on the side; make it feel special. i received many compliments and i would urge you to get this one if you are seeking comfort. it was pretty true to size and because i'm an average height i wore a small block heel with it.",[]
1311,Cute and decent make!,"Someone returned my size so i got to try it on in store. the cut is very flattering, the material is stretchy. the lace part is nicely made too. overall great piece. the petite waist did hit me a little higher than on model, i have a regular torso and short legs (and overall usually need petite)","['cut-very flattering', 'material- stretchy', 'waist- petite']"
1318,Nice winter dress,"Great dress, fit perfectly warm for the winter, i live in florida it will be great if we get a winter next year. very comfortable and easy to wear.",[]
1330,Versatile comfortable dress,"This dress is comfortable and versatile - one could wear it to the office or to a social event, day to night. i didn't find the sizing to run as large as some of the other reviewers did. i felt it was true to size. it is not lined so you would need a slip under it if you wear it with tights or nylons, otherwise the skirt will cling.",['dress- comfortable']
1336,Beutiful dress,"Decent quality. i am 5'4"" 130 pounds. m is too big. runs slightly large.",['m-too big']
1574,Truly beautiful dress,"I'm an avid retailer shopper.
i bought this dress for my niece, her style tends to run 
bohemian/gothic.
the style, fabric and overall design/quality of this dress, is something i felt she would like (even though the color is not black).
she loves it - perfect fit. she accessorized it with her usual biker/moto jacket,boots, etc.
but it looks awesome on her!","['style- bohemian', 'style- overall', 'color-even black']"
1592,Gorgeous detailing,"I never write reviews but this dress is so fantastic i felt compelled to write one. it has unbelievably gorgeous detailing, from delicate beading and sequins on the bodice to the three layers of the skirt: slip, floral pattern, pleats. i literally feel like a princess/ greek muse in this dress. can't recommend it enough. true to size; i'm 5'7"" and 133 lb and got a size 4.",['dress-so fantastic']
1957,Perfect sweater dress to brighten up winter.,"This dress is really fun and easy to wear all winter. the colors are really easy to pair and like the last reviewer mentioned, i love the sheer sleeves. i was very worried about the comfort of the fabric because most sweater dresses always fail. this dress is extremely comfortable to wear. it is not scratchy at all. it is soft and comfortable for winter even indoors with the building's heat blasting away. the dress will fit the size you normally wear, however it may show lumps and bumps. i would","['dress-really fun', 'colors-really easy', 'reviewer- last', 'dresses-very most', 'dress-extremely comfortable']"
1960,Lovely sweater dress,"This sweater dress is beautifully unique in that it has lovely sheer sleeves to dress it up, but it's made of a soft sweater material that feels comfortable, warm and wintry at the same time. it does run true to size, i ordered a small (5'5"" and 118 lbs). knitted and knotted has come up with some killer sweater dresses this season!!!",['dress-beautifully unique']
1972,Classic,"A wardrobe addition to dress up, or dress down.
the sheer sleeves are a nice detail...

(i'm 5'6"", and the length hits me at the knee.)",['sleeves- sheer']
1973,Slightly disagree with others,"I wore this dress for christmas and agree that it is beautiful (i received many compliments), while i agree that this sweater dress is beautiful, i'm a little worried about the quality. after just a day of wearing it, it seemed to have lost it's shape. the bottom hem of the dress looked stretched out and it sagged slightly all over. i'm 5'7"", 135lbs and my typical size is a m/4 and the dress fit perfectly initially, but not so much by christmas dinner. i'm not giving up on it because i was still","['dress- many', 'hem- bottom', 'size- typical']"
1976,Beautiful dress,"This dress is absolutely beautiful! the grey is more vibrant in real life than the picture suggests and the maroon red is perfect for fall and winter. seriously, this is not your typical sweater dress; the sheer sleeves elevate it to a whole other level. it comes to just above the knee on my 5'7"" frame. it is a bit looser on top (i'm 32c) and more form-fitting around the hips but not tight or clingy. and so comfortable! i am 122 lbs and took my usual small so i think it runs true to size. the sl","['dress-absolutely beautiful', 'grey-more vibrant', 'picture- real', 'red- perfect', 'sleeves-seriously sheer']"
1981,Quality and look make it a winner,"Nice quality, soft fabric, sleeves definitely make a unique statement. the fit worked for me, although it could have more room in hips (for my hourglass figure). got m, size l was way too big. i am 34d, but the dress can definitely accomodate bigger chest. the color are my favorites in this season.
wear it to stand out!","['fit- more', 'l-too big', 'dress- 34d', 'color- favorites']"
1988,Lovely long loose,"I wanted to buy my usual mp but was sold out and so was normal m. i got the regular l and it fits like a shift dress and does not enhance my curves. it looks like a luxurious knitted sack but i mean that in a good way. it is very comfortable, does not cling, and reaches just below my knees. i do worry about the stretch factor as other reviewers have noted but since i just received it we will see. i do not like the sheer sleeves. i wish i could take them off. i do not like the button loop at the",['reviewers- other']
2053,"No, just no.","I wanted to love this. couldn't wait for it to arrive.  unfortunately, it doesn't look anything like the picture.  i usually wear a m/l in holding horses so i ordered a l but as soon as i held it up i noticed it was ridiculously large. the fabric is on the heavy side so the dress just hangs in a very unflattering way. and, it is extremely shimmery.  i love velvet, but the texture and sheen of this dress was just over the top. sadly, it is going back.","['fabric- heavy', 'dress-very unflattering']"
2054,Gorgeous for fall,"I bought the ""light grey"" color. the dress in the photo does not look a thing like the dress in person, it does not look grey at all but more of a light teal/light blue.  it is absolutely gorgeous and has a slight swing shape. i took my normal size xs.  the end of the sleeves (where the buttons are) are very tight but still fit, you just have to be careful taking off or else undo the buttons.  also online inventory says no one has this in store, but i did end up finding it (rockefeller).","['dress- grey', 'buttons-very tight', 'inventory-also online']"
2056,Not quite the right fit,"On the hanger, this looks like a great lbd. on me, not quite. the bell shape of this dress made it appear that i was carrying extra weight in the middle.  for reference, i tried a 0p, and i'm 5,1"", 102#, and 34a.",['shape- extra']
2058,Picture misleading,"I ordered this and there is just so much fabric! in the pictures i think it is pinned in the back, in the main photo, to make it look more streamlined. definitely a miss!",['fabric-so much']
2059,Cute!,"This dress is cute!! i ordered my regular xs which was too large but liked it enough to exchange for an xs petite and hopefully the fit will be better. (the xs was much too wide and came past my knee. i'm 5'2' and 123 for reference).  the grey is very pretty and is blueish gray... very misty and unique. the pockets are awesome and i like that it's lined in a fine poly that shouldn't cling to tights, etc in the winter. if you can find a size that fits you, buy it!","['dress- cute', 'fit-too large', 'xs-too wide', 'grey-very blueish', 'pockets- awesome']"
2061,Cute but runs large,"I was really hoping this dress would work out, as it looks like it could be a staple outfit for work! the material is very nice, but unfortunately the dress was way too big. there is a band right under the chest that i would think should be somewhat fitted to give the dress some shape to your figure, but it was wayyy to big on me (especially considering i am large-chested! i will be returning this.","['dress-really staple', 'material-very nice', 'dress-too big', 'band-somewhat big']"
2063,Great with leggings,"This dress is too short for me to wear as a dress, at 5'7"" and over 40. however is is great with leggings and boots.
it drapes nicely not over sized like many dresses this style. the color is more earthy than pictured. it's actually nicer in person than online. and it has a wonderful texture to it. i was drawn to it when i walked in the store they had it on display under s short cropped jacket and boots.","['dress-too short', 'color-more earthy']"
2065,A shirtdress that swings,"This is a really cute and flattering dress on me. i am 5'4"" 120 lbs and the 4 is a perfect fit. i am a little busty but the empire seam brings the dress back in slightly below my chest so it does not tent out.the asymmetrical hem makes it really flowy when you walk. the under dress is a lightweight fabric in a sheath cut that is shorter than the over dress which is a fun detail. the over dress material is somewhat gauzy and it moves as you move. the pockets are positioned in the front which is a","['seam- little', 'hem- asymmetrical', 'dress- under', 'material- over']"
2067,Classic!,Very comfortable to wear. you can wear it any season.  it runs true to size.  nice fabric.  it&amp;#39;s a simple black dress.  love it!,['#39- simple']
2068,Enormous,I ordered a size 0. the dress was extremely large. i am 5'2 and weigh 110. i guess you really must be 5'9 like the model to wear this dress. such a shame..,['dress-extremely large']
2069,Not my kind of fit,"I wanted a comfortable and loose casual dress. i liked the pictures and decided to give it a try.
the dress turned out to be too loose (i got size 4 after checking the measurements chart, i'm 5'7' 125 lb and usually wear s). i could practically wrap myself in this dress. besides, it looks a bit too long (well, i'm not as tall as the model in the photos and i don't like wearing high heels).
the material looks faded, not as bright as in the pictures. i like distressed and vintage style, but this","['dress-too loose', 'material-as bright']"
2075,Wonderful but button issues,"This dress just feels and looks amazing. i love how it isn't too short like a lot of new styles. i think it will be wonderful with leggings or tights in the winter. i also love the plaid cuff detail. the only drawback is the buttons need to be reinforced. i got home and realized one button was missing. i went to the store to swap for a new one and when i went to cuff the arms, 2 buttons popped off!","['dress-just amazing', 'drawback- only', 'buttons- new']"
2076,Why isn't this dress sold out?!,"It is such a pretty dress. the pics don't do this dress any justice. the cut and style is so flattering. the colors are gorgeous. you can wear it on a cool evening in summer and well into fall. i absolutely love this dress. even if the material appears a bit rough, there is a slip underneath.","['cut-so flattering', 'colors- gorgeous', 'material-even rough']"
2077,Velvet crush,This dress is so soft and cozy and pretty.  love the shine and interesting sheen whenever you move.  very comfortable and looks great with a variety of layers. i want to buy more colors but right now i just have the mauve. ordered size m and i'm 38-27-35 #135.,['dress-so soft']
2078,Babydoll,The colour is gorgeous but it's basically a baby doll dress - it looks like the waist is much lower on the model but for my height and large chest it' fell like a baby doll or a maternity dress. not flattering. pockets are a nice touch though.,"['colour- gorgeous', 'waist-much lower', 'pockets- nice']"
2079,Versitle,"I ordered this online with out trying it on the store. it does hang a teeny bit loser than in the photo of the model but in my opinion doesn't look bad. plus, i'm not a model...;) what i did was put a thick belt on and it just brought the dress to a new level. love it with a belt. i am an art teacher and it was perfect for work and then going out after with friends. (the school is not secular so the skirt must be long enough (it hit right above my knees in the front) as well as the sleeves) i ag",['school- secular']
2080,Classic and comfort,"This dress is gorgeous yet sturdy, it is all about the lace. size regular 4 fit my chest area well and i like the midi look (i am 5ft2in, 34b, 26 waist, 36 hips). whether regular or petite size, when i walked or turned, the pleats added too much volume and looked overwhelming and no shape. i tried it with a belt and it looked better, but looked odd because the pleats poofed at the belt area. i tried with a sweater, jacket...then finally gave up. it would look gorgeous on a tall thin gal.","['dress- gorgeous', 'size- regular', 'pleats- petite', 'pleats-better odd']"
