,Title,Review Text,aspect-opinion
4782,"Cute, but not cute enough for me.","When this appeared on line, i thought t would be a sure thing, color (blue), cut and style, this dress appeared to have been made for me, but i ultimately i ended up returning it for several reasons. fit: i was worried about the length on my 5'5"" frame but it was actually long enough. i have narrow shoulders and average arms but i found the shoulders or maybe it was the upper arms to run slightly small in my regular size which caused some strange poofing at the shoulders. not sure if going up a",['dress- blue']
4794,"Cute, but something is off","I am short (5'3"") and very curvy. i usually get petite in dresses. something about this fit was strange. it was definitely a little shorter than most petites. the lace detail on the front of this dress is really cute and it is a color you don't see often so i kept it.",['detail-really cute']
4799,Perfection,This dress is amazing. bought in orange and fits wonderfully. great quality and could transition in between seasons,['dress- amazing']
4801,Loved the style but the fit was off,"Loved this dress until i tried it on! it was too big in the body and tight on top in the arm area. from the reviews already posted stating the guy was great, i'm wondering if i just received a defective dress? i also wish the dress were a truer orange/mango color instead of a burnt orange since this dress is for spring/summer.","['guy-already great', 'dress-just defective', 'dress- burnt']"
4802,Perfect shift dress!,"I love shift dresses and i love t linen so this one was a must for me. i had it in my inbox as soon as it came out on the website and then i found it in the store and had to try it on. i took the six and the eight to the fitting room because i run in between, and the six fit better so i guess it runs a little bit large. really it just depends on how you want it to fit. the length is great too, about 3 inches above my knee, i'm 5 foot 5, which is exactly where i like my dresses to hit. i got the",['length- great']
4805,Linen coolness,I love the way the dress fit definitely a flip flop by the poolside bar dress. i ordered the mango colored one and was disappointed that the color resembled a dark squash orange and not as bright as it looked in picture. i think it will look nice with a tan so i will keep it. wouldn't plan to dress it up too much because it will definitely wrinkle ! i am a petite 5'4 and got the regular and it fits just above my knees which is good for my taste!,"['mango- disappointed', 'color- dark']"
4806,Cute and comfy!,"Purchased this in the burnt orange color - very nice!
will be lightweight for our hot, humid summers but has a bit of pizazz with the lace up front.
the slip is nicely made with strap attachments in the shoulders so they do not slip.
i wear a ton of dresses in the summer so this will definitely be a go to item for all the horse races we attend. 
looking forward to snagging a nice derby style hat to match!",[]
4817,Muddy color,The shade of orange was quite muddy and not vibrant like photos show. it's going back .,"['shade-quite muddy', 'photos-not vibrant']"
4820,Amazing dress!,I tried this dress on in the store in the mango color but opted to order the blue. the dress is beautifully made and the fit is fantastic.,['fit-beautifully fantastic']
4823,Comfort,"I purchased the mango. it is flattering with my olive skin and golden brown hair. i am keeping it. i'm used to linen so no surprises there. i agree with a reviewer that said it will work in summer and fall. i could wear this walking on the beach, to a summer casual dinner party. i plan on wearing gold sandals and gold jewelry. this will make the feel more summertime. then i will wear boots with it in the fall. i'm very happy with the choice. my store didn't have the blue. the fit is tts. i'm 5 f",[]
4825,A great addition to any wardrobe,I bought the dress in mango. i love the color. it is very vibrant. the fit is great and i imagine getting a lot of use out of this dress during the summer months. my only complaint is that i expected the fabric to be a little bit heavier. i find it to be kind of thin.,"['fit- great', 'complaint- only']"
5485,Unique style,"I love the feel of the fabric and design of this dress.  i look forward to changing the look with cowboy boots or fringed booties. i also like the option of wearing it opened over a white tee and jeans. worn loose or belted, it can be different every time you wear it. it does run large so you may want to size down.",[]
5493,Perfection,"I'm not a western girl but this dress is so adorable. i love the colors, it's adorable and unique. while its definitely a full swingy shirt dress i didn't find it overly large. i plan on wearing as a dress with sleeves rolled up. under the pilcro denim jacket it looks so cute. and open over jeans with a white tank like a jacket.",['dress- western']
5495,Love it!,"I am not sure who in the world could really wear this as a dress without belting it...definitely a super weird cut. extreme a-frame. the fabric is just absolutely gorgeous and it is so well made otherwise. i thought about trying to size down but it would be too small in the shoulders for sure. i am going to keep anyway. i've already worn it with jeans and a t-shirt and as a topper with a denim shirt dress. it actually looked fantastic with both. i'll get a lot of wear out of it, just not the way",['fabric-absolutely gorgeous']
5496,Not flattering,"I love the color patterns and fabric.  it has full lining!  my biggest problem with the dress is the swing style - makes it more like a maternity dress and so unflattering?  a straight (shift) style would have been much better.  dress runs large, however the arm/shoulder area is tight.","['problem- biggest', 'style-so straight', 'dress- large', 'area-however tight']"
5497,Super cute but big,This dress is super cute. good quality. from the front it is very flattering and hangs well. from the side and back it looks huge. i ordered a size 4 and i am a normal 6 or 8. i have re-ordered the 0 and size 2 to see if there is less material (others have mentioned that the arms are smaller in the smaller size. my trouble area is my hips so i don't think this will be an issue as i am quite small on top). if not i will have it altered because it is so cute and can be worn many different ways.,"['dress-super cute', 'material- less', 'arms- smaller', 'area- hips']"
5498,Beautiful but huge,"I bought this dress in store today in a size 4, i usually wear an 8 (so i was thrilled) the print and details are gorgeous but it's a very wide swing dress, there is a lot of fabric and it has no waist. i'm going to wear this with a belt so it's fine but the images online are a little misleading.","['print-so thrilled', 'lot-very wide', 'images-so fine']"
5499,Yee haw,"This is a very cute fall dress that can be worn in a myriad of styles. from styling it with a pair of wedges and dark tights, to donning a bolo and ankle boots, heads will turn when you walk into the room.",['heads- dark']
5502,"Cute, definitely needs to be belted","I'm a 36ddd, and have a bust about 42"" so when i tried this on in a size 12, i honestly didn't expect to be able to squeeze it on... and yet i had inches upon inches to spare in the bust. this really is built more like a tent than a dress. on the bright side though, if you belt it, and gather the extra material at the sides it'll define your waist and the skirt has lots of swing and flounce to it. i do love a line styles!! 

i found i had to roll up the sleeves otherwise the dress looked too s",['skirt-though extra']
5504,Adorable!,"Was so glad i gave this dress a chance - it's adorable! it does run large. i am 5'6"", 125lb and the 2 fits perfectly. it is super comfortable. i am taking away a star only because it doesn't have pockets - with all of the fabric - how were pockets left out?",[]
5506,"If only i was 5'10""","Great dress in terms of material, quality, print...something about the weight with the lining made it not work for me. i ordered one size down as recommended by other reviewers, but that didn't work; there was too much fabric for the length and the lining made it look heavier. i ordered a medium and i""m 5'5"" on the curvy side. oh well. i've had so much luck with other retailer orders so i'm not too disappointed.","['fabric-too much', 'lining- heavier']"
5508,Love this dress but definitely size down,"I saw this dress in my local retailer store and had to try it on. i cannot say enough good things about this dress! i love it!
 like other reviewers said it runs very big. i am 5'8"" 138 pounds and usually wear a size 6 but got this in a 2. fits like a shirt dress should once i sized down.",['reviewers- other']
5510,Larger than life!,"Larger than life in both size and personality. this one runs pretty big however the detailing in the fabric itself and embroidered collar balance that out. it's even more gorgeous in person! 
for reference, i'm 5'7"", 125lb, straight up and down and i usually go for a 4 or 6 / small. i got a 4, but could have easily fit into the 2 or even the 0.",['one-pretty big']
5513,I am in love.,"Based on others' reviews, i knew i needed to try this beauty on to be sure of my size. as others mentioned, it runs 1-2 sizes large. but, unlike others, i don't feel i need a belt at the waist. i am 5'2"" 140# 34d and with my body style (super short and not super slim in the waist but also busty) this is the perfect boho fit and the perfect drape!!!  and the design and quality are superb to boot!!!","['others- large', 'design-also perfect']"
5514,So cute!,"As the other reviewers stated, it does run large, i sized down 1 size and it's perfect. great dress to wear so many ways.",['reviewers- other']
5515,"Great dress, but runs big","I agree with the other reviews - great dress. i got a ton of compliments on it, but i had to take it to a tailor to get it taken in. not a fan of belts with dresses, but definitely wanted it so had quite a bit taken in. not sure why this seems to be a reoccurring issue with retailer. i was bummed i had to spend money to get the dress to look even somewhat like the photo.",[]
5518,Adorable!,"This dress is loose, unique, and super cute! you'll get noticed in this dress! i ordered down a size.",['dress- loose']
5521,Into the west,"Totally out of my style range but am totally enamored by this tent dress/shirt/coat thing! ok, so yes it's very very tenty, but fits on my shoulders (size down 1x or 2x if you're narrow shouldered) and i use one of my leather belts to gather the material and make myself a nice western fit & flare! like the model shots, this looks great with a tee and skinnies. if you have tried the marvelous silk santee swing dress, the escalante has the same amount of fabric that reviewer either love or hate. i","['escalante- marvelous', 'reviewer- same']"
5678,Surprisingly comfy and flattering,"I ordered the xxs p and it is almost big, so between true to size and big. it is both flattering and stretchy. the waist comes in nicely, the sleeves are not annoying, and the sparkle add to the lbd in my opinion. length was right above the knee.just. i am 115 lbs, 30dd, 26.5 in waist for reference...","['sleeves-nicely annoying', 'length- right']"
5858,Gorgeous dress,"This is a beautiful dress. it's a great weight, unique pattern, and has gorgeous colors. it's fairly forgiving because of the heavy fabric but may run small on bottom. i am a 10 or 12 in pants, 10 dress right now and i bought the 12. i am 5'8"" and 175 lbs, and 36c - also in the last stretch of a weight loss journey so if that helps anyone choose sizing... also i have to buy long or tall pants and this dress was not too short and did not show my smooth wear underneath. i love it and bought it at",['dress-also tall']
5860,Easy summer dress,"Comfortable and loose fitting- perfect for summer weekends when you just want an easy dress to throw on. can go from home to running errands to going out for lunch. good color, too!",['fitting- loose']
5867,This is gorgeous,"I think this fits to true to size. i am 5""2 and 107 lbs. i always wear a xs. it was a tiny bit tight in the bust if i wore a big padded bra (34b). if i wore a normal very little padding bra, it did not pull much across the bust.",[]
5874,Cute,Dress is actually very cute - i like it better in person than online. the color is a very pretty deep denim blue color. it is cut very roomy/swingy. length is a bit too long in the back for my taste but still like the way it flows. i am very slight of frame and on me there is a lot of extra material but nothing a good tailor can't fix in a jiffy. perfect for a summer day/bbq or casual party.,"['Dress-very cute', 'color-pretty deep', 'lot-very slight', 'tailor- good']"
5882,Gorgeous,"This is truly a lovely dress. the colors are beautiful and i love the contrasting but complimentary fabrics which add interest to an already elegant dress. the material is substantial without being stiff so that it flows gracefully and it flatters the figure.
in my opinion if fits true to size, i'm 32b, 5' and 103lbs and i got it in a 2p which is the size i normally get in dresses. it is slightly more loose than other retailer dresses in the same size but it still follows your curves without being","['colors- beautiful', 'material- substantial']"
5885,Gorgeous shift!,"I love it. perfect, body hugging, just right length and great fabric colors. this shift fits just above knee and follows every curve. it is, however, unforgiving-there is no room in this to cover bumps or bulges; it is sleek and so figure-flattering. i am 140 lbs, 5'5 tall and 34d and it fits perfectly. one more pound and it wouldn't have zipped! i got a size 6 (my usual)!but too tight had to size up to 8. if you are on the fence, go up a size. i can't, however, imagine wearing this sleeveless a",['room-however unforgiving']
5887,Versatile dress!,Easy to take this dress from casual to dressy! super comfortable and cute!,[]
5889,Not for the curvy gal,I love this dress but when i put it on i was aghast! the chest was tight and the body was voluminous!! added the pounds which no wants! best left to the waify girls.,"['chest- aghast', 'body- tight']"
5894,Easy breezy,"Love this dress! it is tighter in the chest area than maybe expected, but not unwearable, though i am smaller chested. it will be great for hot summer days as it has a light lining.",[]
5906,Maeve stunner,"This dress is gorgeous, well made, lined, and tts. i get compliments each time i wear it and find it unique yet classy and appropriate for work. unlike some of the maeve tops i have purchased this year, it does not run big, and if you are banking on a little stretch, i would order the next size up. you won't be disappointed!",['dress- gorgeous']
5907,Love this dress,"This dress is fabulous with attention to most details. 5'4"" 103 lbs the 00 fits perfectly. overall fit is excellent, sleek, but not form fitting so very appropriate for work. length is also great, another plus.for work, many times the dresses are just a tad short, but this is great. arm holes are also great, not overly long as they often are. very nicely lined, substantial fabric. the only lack of attention to detail is they did not include the bra strap holders. why can't more dresses be made t","['dress- fabulous', 'fit- overall', 'length-also great', 'dresses- many', 'holes-also great', 'lack- only']"
5914,"Pretty, casual dress.","It's relatively light material; even if you layered a sweater over this i can't see it being good for winter. i'm in california so it's fine :) length is great - i'm 5""4 and it hits just at the knee. i'm a true size 2/small and this fit great, even though i have a curvier figure. pretty classic dress.",['length-so fine']
5918,Love it!,"This dress is everything everyone said it was in the reviews. so cute and beautifully made. fully lined.
i felt it ran a bit small as i had to return it for the next size up, more so in the bust area. but the fit and length was perfect in the size 6. 5""10, 125lbs. i will say that all the raving reviews made me purchase
the dress without hesitation and i'm sure glad i did!","['fit- perfect', 'reviews- sure']"
5920,"Well made dress, fit could be tricky","The patters/colors on this dress are much more stunning in person. it is lined and feels very well made. the pockets don't add bulk to the hip area as many times they do, which is great. the fit can be tricky if you have any semblance of curves. if you can, try this one on in a store before buying. for reference: i am 5'7"", have broad shoulders, am pear shaped (i have hips and a good sized rear end), 34b bust, weigh 145 lbs., and generally wear a size 6 or 8 for tops and bottoms. the size 8 fit","['patters-more stunning', 'pockets-as many', 'fit- tricky']"
5921,This dress makes me happy,I love this dress. it fits great on curvy girls. the armholes are a bit big (i had to get it altered) but its great. it had two pockets which are great. good length and comfortable fabric.,['armholes- big']
6082,"Warm, cozy, timeless, and sexy","It's not often you can find a dress that is warm, cozy, timeless, and sexy at the same time, but this one is it. the material is thick but clings to the body in all the right places. i normally wear an xs or s, and in this i took an xs. sleeves are nice and long. your shoulders are exposed as much as you want them to be, depending on how low you fold over the collar piece. i chose to tack mine down in place, so i'm not always adjusting it.

i wore this dress with black heeled over-the-knee boots","['one-often same', 'material- thick', 'sleeves- nice']"
6083,Simple and well structured,"This initially caught my eye online and then i immediately tried it on when our store received it. the dress is simple and well structured with a tight sweater weave that almost has a"" hold u in"" feel. therefore, it fits like a glove on!!",['dress- simple']
6084,Runs big,Love the dress. i usually wear a small and will be exchanging it for an x-small.,[]
6087,Awesome sweater dress!,"Lovely body hugging dress. hits just below the knee. great with boots as shown, or with heels. very soft material and the peppery color is really pretty. i can see myself wearing this to work and out at night. this is a winner!",['color-very peppery']
6089,Great casual dress,"I went back and bought this dress after a sales associate told me that it was super cute on but didn't look like much on the hanger. i'm 5'3"" and curvy and the s fit great. it will look great with boots or booties. it's very comfortable and nice quality material.",['associate-super cute']
6091,I will live in this!,"Soft, comfy, great fit. this is the perfect cozy item for fall and winter. looks really cute with the sleeves rolled or cuffed slightly. the fabric is patchworked with linen and a terry/jersey material. i'm usually a medium and the medium fit great. slimming lines and does a great job of being swingy/flared, without that tent look.",[]
6093,Soft material,Great dress. looking forward to wearing it with tights. fits great.,[]
6105,Much better in person,"This is such a fun dress. the linen and cotton mixture is very unique and comfortable. for reference, i am 5'3"" and about 110 pounds. the regular xs hits me exactly the way it is shown in the photo. the color is a true oatmeal which is so nice for fall and even though i am fair with strawberry blonde hair, it doesn't wash me out. the sleeves are a little long but i rolled them once and it is perfect. i love this dress and it will look great with booties or boots for the fall.","['mixture-very unique', 'xs- regular', 'color- true', 'sleeves- little']"
6118,Dresses differ,"I tried this on in a different retailer a couple of weeks ago... ....tried on a different one last night..same size and it looked baggy, sleeves way too long, etc.  let me add that i am usually a xs/s petite but some regular extra smalls will work also.  this was a xs reg.  even the sa could see that one looked like it fit smaller ( i showed her the photo in my phone) while this one swallowed me.  bottom line, you will need to try this one on as the sizes seem to vary.","['smalls-usually extra', 'sa-even smaller', 'sizes- bottom']"
6124,Looks like reconstructed old sweatshirts!,"I truly cannot understand the great reviews on this dress!  i purchased in both a sp and a mp.  i am 5'2"" 120#.  the mp fit perfectly.  i definitely wouldn't keep it though because it looks like someone sewed a bunch of old sweatshirts together.  it's not super soft, coarse on the inside, and feels old.  the back is longer than the front, it just looks like something my daughter would make in sewing class out of scraps.  even with leggings and great boots, it looks worn.",[]
6133,Cute and eclectic,"I love this dress.   i believe the picture on-line doesn't show the unique pattern and design.   it does have an interesting design.    add a long vest, statement necklace, and boots - you will be quite fashionable.",['picture- unique']
6278,Not amazing,"Not a huge fan of this dress, will be returning it.
fits too big and not flattering.
fabric is thin and shows any lumps and bumps you may have.
color is not as pretty in person as in the photo - the photo looks like a nice rust color but the dress is actually a boring brownish olive.","['fabric- thin', 'color-pretty person', 'photo- nice', 'dress-actually boring']"
6418,Too itchy too metallic,"This pretty bohemian dress is murdered by the horrible rayon fabric with metallic thread that feels like little needles pricking my skin. i have a pretty high itch tolerance as wool doesn't bother me too much. i'm not sure how most of the reviewers are tolerating this dress, even with the slip, which doesn't cover the arms and makes me want to tear this dress off. i decided to keep and wear as an autumn/winter dress in which i will remove the slip, wear a deep scoop neck long sleeve top undernea","['needles-pretty little', 'wool-pretty high']"
6552,Great transitional dress!,"After reading the reviews, stating that this dress was a tent and only fit for the tall and small chested, i kind of had a battle of wills in my head over ordering it. it is very ""me,"" but me is also 5'5, curvy, and possessing a 36g bust. i had to post a review, because i received the dress today, and i actually love it. i ordered a 16 and i love the fit. i know it's flowy, but on me, it's far from tent-like. i think it's great now as a pre-fall piece with some sandals and a jean jacket, and as",['dress-only tall']
6558,"Very beautiful, but material is scratchy and stiff","I really want to love this dress, the style and colors are so nice and easy. i like the loose flowy feel of the dress. it runs a tad large, but that is part of the style. what bothers me is that the fabric and embroidery is very stiff and itchy, to the point where it is uncomfortable on my arms and body even though it is a loose fitting dress. also, it has lining which is nice for modesty, but with the stiff/itchy factor mixed with lining, it feels a bit cumbersome. i haven't decided if i will k","['style-so nice', 'fabric-very stiff']"
6559,Nice styling but shapeless,"Thought this would be a great dress for warm days, but alas it fit like a sack. love floreat and have a few of their well made dresses. shame this did nothing for my curves. ordered an 8, usually wear a 10 and it was a tad narrow in the shoulders. if you can sport a loose swingy shape, this is a great dress with nice detailing, but sadly the shape did not work for me.",['shape- nice']
6566,"Pretty dress, seems well made","When i received this dress i was surprised by the weight of the fabric. it's not as light and gauzy as the photos appear, and it is fully lined. it's more substantial in a good way. also i had thought it would be more of a straight cut but it's definitely a swing which i prefer. with the lining, it does stand out a bit from your body so it's not a clingy look at all. i like it a lot but i don't think it fits the way you would expect from the photo. it's roomy, i could probably have sized down. i",['photos-as gauzy']
6567,Another winner from floreat,"I found this dress to be a perfect flowy fit for the super-hot tail end of summer. this definitely is not a form fitting dress, but i bought my regular size medium (size 6) and think it fits perfectly. i have a pretty small chest and find that sometimes these a-line dresses look better if you don't have a lot on top making them ""tent out"". just my opinion. personally do not think it has an abundance of fabric. in fact, it is a lot less roomy than a lot of others in this cut due to the embroidery",['dresses-sometimes a-line']
6569,Confirmed: a tent,"I should have listened to previous reviewers. but the dress looks so good on the model in the two dimensional pictures. when it arrived in the mail, i realized this is a mistake. it has no shape, material is poofy and feels cheap. it is going back.","['dress-so good', 'material- poofy']"
6571,Love this dress!,"I usually wear a 4, but ordered a 2 & 0 because of the previous reviews. the 2 fit perfectly. the 0 was too snug across the shoulders. both sizes were the same length and width except the shoulders.the material is beautiful and seems very well made. i am thrilled with this purchase.it looks exactly like the photo.","['sizes- same', 'material- beautiful']"
6573,Does not hang well,"I am typically a small/6 in dresses, but i should have gone with the other reviewers and sized down. it had no shape, but hung like a paper sack. the armholes fit perfectly though, if i had sized down they may have been too tight. i am 5'6"" 140 lb
i will return, too bad because it is a pretty dress!",['armholes-too tight']
