,Title,Review Text,aspect-opinion
13138,Cute and stylish,"This dress is adorable. thanks to everyone who commented that the dress runs small as that's definitely true. i ended up ordering up two sizes and got a perfect fit. i was afraid the wrapped skirt might emphasize the hips too much, but that isn't the case. it adds a bit of quirky style and makes this different from the usual shirt dress. it's great with booties or chunky wedges.","['dress- adorable', 'dress- small', 'skirt- afraid']"
13145,"Style, comfort, great fall color","Runs big, but the fabric is nice and comfortable. i had to return first order and order the next size up. it is short in the front but a nice length in the back. it will be a great dress for fall and the color is unique, more brownish orange than red. it will look great with boots!","['fabric- big', 'color- great']"
13149,Defective!,"I wanted to love this dress. i saw it in the catalog in blue, and wanted it. however, for some reason i took my sweet time in ordering it, and by the time i did, only the orange was available: but on sale. i was so excited when it arrived, and as i was trying it on, i thought, this is a bit shorter in the skirt than i usually go but it's so pretty... and then i couldn't get my right arm in the sleeve at all. i wondered if i had caught some of the lining as i was putting it on or something, but n",['orange-however sweet']
13154,Cute dress but......,I love the look of this dress and the material - the problem is that when i tried it on the fit was a bit off. it seems that the arm holes hung down way too much and pulled the dress so it is uncomfortable to wear. i don't think i could have gone down or up a size to make this dress work. it is a shame because i really liked the look of it.,['holes-so uncomfortable']
13177,Runs small,"It's a fine dress, but it definitely runs small, and it's actually a lot shorter than i was expecting, especially since i'm only 5' 3""",[]
13180,"Flattering, size up","I am petite with somewhat broad shoulders. iusually wear 2 or 2p dresses. i ordered a 2 and it was tight in the shoulders & hip. otherwise this is a cute dress, looks better on the person than in pictures. the tie is an interesting twist on an otherwse basic shirtdress. the fabric drapes nicely on the body, i reordered dress in a 4. inever wear size4. hopefully it's not too big or long.",['tie- interesting']
13184,"Flattering, quirky shirtdress","When i first saw this in the store, i loved the idea of this shirtdress with a twist. i tried it on in my usual size 4 but could not get it over my 32d bust. i wrote it off and moved on. back in the store shopping for a party dress, i saw this was now on sale. although not right for the party, i decided to try it in a bigger size. a size 6 was not available but a size 8 was. perfection! if you are willing to size up, you will be rewarded with a comfortable, versatile dress that can be super casu",['size- available']
13190,Love this dress!,"This is my favorite kind of dress: comfortable, unique, and can dress up or down. i am 5'2 and 100 lb, and bought the regular 0 because there were no petites available. it fit perfectly! the material is buttery soft and looks like it will hold up well, and i love the orange-red color. the tie detail makes this dress stand out and i find the cut very flattering. so glad i ordered it!!","['petites- regular', 'material-perfectly buttery', 'detail-very flattering']"
13193,Adorable spring time dress!,Thank goodness i looked at everyone's reviews beforehand because i ordered a size up (4) and it fits perfectly. i am usually a size 2 but can definitely tell it wouldn't have fit correctly had i ordered a 2. the orange color works well for either a fall dress with leggins or a spring dress by itself. i love it!,['color- orange']
13212,Need petite in this one,"I tried on the refgular xs and it fit, btu the cut was wring on me, i moved up the dress as though it was cut ""petite"" and what a difference! i will ahve to roder the petite for sure.

te material is a thicker knit, very strectchy and warm enough to carry the dress through winter and spring.
the shoulders are well covered, in a flattering way. the chest area is crossed over ""open"", not stiched close, so yo ucan adjsut as needed. te ""tie"" jsut falls but is attached to the dress on one side, so it","['difference- sure', 'material- thicker']"
13233,Fits like a glove...,"I spotted this dress at my local retailer. to be honest, i saw it on a rack with a sale sign on it and didn't think much of it. then i saw it on a salesperson...wow! i think this dress looks much better on someone than on the hanger...so i recommend trying it on.

i am 5'3"", 32b...and i bought an xs. it fits really well...right about the knee, similar to how it is shown in the photo so taller women may find it to be a little shorter.

the ruffle/fabric that comes down the side adds an interesting","['dress-much better', 'women-so taller', 'ruffle- interesting']"
13532,Disappointed because not what i expected,"I agree with the first reviewer exactly. beautiful fabric and ""idea"" of dress (looks stunning on model), but huge and shapeless in person like a tent. not at all what i expected when ordering a 2 petite. sadly, has to be returned.",[]
13538,Disappointed,"The xs was too large on me and i'm not a tiny person. while the dress was beautiful on the model, in person it had way too much fabric and fit rather tent-like. the fabric is gorgeous and the dress would have worked if it were more of a fitted style and had half the amount of fabric on the bottom. not flattering at all.","['xs-too large', 'dress- beautiful', 'fabric- gorgeous', 'dress- more']"
13615,Gorgeous dress - spectacular!,"This dress is a beauty. i am 5'11"" and plan to wear this as a tunic over leggings or straight leg pants. the embroidery is really pretty, even though it does run a bit big. i would have liked a size 12 or less but it was completely sold out except for a size 14. it is so nice, with gorgeous high quality denim that i will make the best of it - may need to get some tailoring but in my mind, this dress is so worth it.","['dress- beauty', 'embroidery-even big', 'dress-so best']"
13627,Flowy and comfy,"I was a little afraid to order this dress online but my local store only had a small left, so i jumped hoping the fabled net would appear, and it did. this might be my favorite retailer dress thus far. i ended up buying a large due to the fear of the front being too short, it was a good call. i'm sure a medium would have fit up top but i have longer legs and i know i wouldn't have felt comfortable in a medium's length. plus i tend to like the oversized look. i paired it with some slouchy socks and","['store-online local', 'net-so fabled', 'medium- sure']"
13642,Will take you anywhere,A slip underneath makes this dress substantial. it's a good 'weather' transition dress-fall/spring. the lace is very pretty and it's an overall great dress that will take you anywhere. i plan to wear burgundy tights and brown boots with ti next weekend.,"['slip-underneath substantial', 'lace-overall great']"
13646,Pretty dress but a little too much fabric,"I've been eyeing this dress for some time and it finally went on sale so i decided to buy it. i bought a size small and while it fits through the shoulders (which is the place i need a little more room) the body of the dress needs to be less sack-like for lack of a better term. i thought it would hide flaws, but unfortunately, it makes me look bigger than i am. it kind of bags out even at the back where the fabric is gathered under the yoke. that being said, i don't really want to return it beca",['body- more']
15568,"Gorgeous look, weird lining. i'm on the fence.","I don't know that i'll keep this, although i really want to. i love the style and the fabric, and the length is perfect for me (i'm 5'3"" and i ordered the petite length - it hits me below the knee). as another reviewer mentioned, this dress runs small in the chest area and does not provide any stretch. luckily for me, that wasn't an issue.

my trouble is this: the liner stops just above the slits on the side, and it's way more noticeable in person than in the photo. the liner is sewn in and yo","['length- perfect', 'dress- small', 'liner-more noticeable']"
15863,Beautiful dress,This dress is really stunning - can be dressed up or down with a jean jacket really easily. runs quite a bit small in the bust (i ordered a 16 to accommodate) but it is really very pretty. i love this brand- they always have such lovely pieces.,['dress-really stunning']
15865,Beautiful! careful with the sizing though,"This dress is gorgeous! i absolutely love the embroidery. a note about the sizing- while the top portion fits snugly, the hip section runs slightly big. i was surprised to find that the 4 i ordered looked baggy, so i went into the store to try a 2, but the 0 was the best fit! however i'm small-chested (and 5'6"" 113lbs), so i was able to go with the 0 as it fit the hips much better. if you're a bustier type though, the top may be tight. other than the tricky sizing, it's perfect.","['dress- gorgeous', 'portion- top', 'section-slightly big', 'top-though tight']"
15869,Just enough bling!,Bought this dress for an indian wedding- it was perfect!,[]
15873,A perfect 10 !,"I have looked at this dress a dozen times online and passed. after reading other reviews felt compelled to see why everyone is in love with this dress. when i opened the box i was blown away. this dress is so beautiful and the crystals, which look like sequence online are high quality, as is the fabric and craftsmanship.
a perfect 10!!!!!!!!!!!!
you must have this dress in your closet!!!!!!!
ordered my usual size and fits perfect.","['dress-so beautiful', 'crystals-online high']"
15881,Buy this dress,"Pictures do not do justice to this beautiful piece of art. the embroidery and jewel detail is exquisite. just don't plan on holding any kids or pets, you won't want to snag it or them.","['Pictures- beautiful', 'embroidery- exquisite']"
15883,Beautiful dress!,The details and colors are exquisite. stop hesitating and get this dress,['details- exquisite']
15903,Quality issues,"This is a truly beautiful dress, and yes, so much better in person.  upon examining the dress, however, i saw some problems.  the embroidery above the waistline was loose in places, there were some frayed ends, and even some &#39;fuzzy&#39; spots where it looked like the stitching had rubbed against something.  the dress is over $250, and for that price i expect the embroidery to be top-notch.  returning and hope the replacement is in better shape.  if so, it will be a keeper!","['embroidery- loose', 'ends- frayed', 'stitching-even fuzzy', 'dress- top-notch', 'replacement- better']"
15911,Slipped on the slip,"I love designs that are flowy/drapey in the front, so this hits the mark when tied in the back. has lots of visual interest. but i agree with the other reviewers.. the slip is super small. dress fits true to size, if not a bit large but the slip is one full size smaller. and you must wear a slip. overall, i'm pleased with the look.","['slip-super small', 'dress- true', 'slip- large']"
15913,Interesting,"This dress did end up working out for me. however i am very narrow in my chest and shoulders and i can see how it would be too tight on anyone with a med-lrg chest and/or broad shoulders. the fabric is light weight, nice for summer. it will need to be ironed and will wrinkle easily but it still looks well made to me. the slip is smaller than the dress but i feel that the dress is supposed to be ""drapey"". i kept it.","['fabric- light', 'slip- smaller']"
15990,Cute but . . .,"This dress is adorable. the color is on the red orange side and is nice for the summer. the cotton is also nice and light. however, the bust is cut short and the skirt is unforgiving to girls with hips. if you have b/c cup or less and do not have an hour glass figure then this dress may be for you.","['dress- adorable', 'color- red', 'cotton-also nice', 'skirt-however short']"
15991,Faulty zipper problem,"I ordered not one but two sizes of this dress to try on and was hoping to ultimately wear to an event - one 00 petite, one 00. the style, color and cut are all perfect. one not so minor downfall, however. the zippers on both dresses were faulty - they both broke in the same spot, both during the first time just trying them on. i can't get either of them to even budge now - will either need to take back or get fixed. very sad about this.","['style-all perfect', 'zippers- faulty']"
16012,Literally unwearable.,"I purchased this in-store in a vivid red color, but didn't try it on until i got home. big mistake! literally the first time i tried to zip the dress, the cheap, horrible zipper noted in previous reviews just...broke. midway up, right under the waist tie. i was trapped in the dress for a good 15 minutes and was scared i'd have to rip or cut the fabric to get out of it; eventually i pulled the zipper apart to escape. can't wait to return this asap.",['zipper-literally horrible']
16017,Cute dress!,"I love the bright red color and also the texture of fabric. it's light, soft and crisp, which is perfect for summer days. the dress is definitely designed for people with a short torso. the waste line is a bit high for me, but overall it didn't feel weird or look funny. there is just something about this dress that made me very difficult to part with. once i tried it on, i had to bring it home with me!",['line- high']
16021,Cheaply made,"The cut and color of the dress is awesome. however, the biggest flaw is the zipper. i only got to wear this dress once until the zipper broke..sad day especially at the price. there also were a number of loose threads. i recommend waiting until it goes on sale. you'll want the extra money for a tailor to fix that zipper.","['cut- awesome', 'flaw-however biggest', 'number-also loose']"
16037,Horrible quality,"I love maeve dresses and have always gotten a lot of wear out of them while still looking great. this dress does not meet those standards. on the 2nd wear of this dress the zipper completely broke. i had to take it to a dry cleaner to get replaced at a pricey cost for a pricey dress, i'm dissapointed.",['zipper- 2nd']
16041,Disappointed,"I love maeve dresses but there are several issues with this one (for my taste). 1) the fabric and color closely resembles my medical scrubs, 2) the zipper is cheap and barely goes up or down, even when it's just on the hanger. 3) the bow is really cute but doesn't make up for the other shortcomings.","['issues- several', 'fabric-closely medical', 'zipper- cheap', 'bow-really cute']"
16051,Terrible zipper!,This product has a terrible zipper that ultimately caused me to return the dress. it's pretty bad when it won't even zip up on the hanger. such a beautiful dress; it broke my heart!,['product- terrible']
16073,Disappointed--will return,"I ordered this dress online in order to get a petite size and am very disappointed. as other reviewers have mentioned, the fabric overlay is very different in person than it appears in the online pictures. the dress is much more casual and looks cheaply made in person. 
as for sizing, i ordered the 2p based on other reviewers' comments about it running small. the 2p fit me fine, although it was very fitted in the chest and i am very small chested #32b#. i can definitely see that being an issue","['reviewers- other', 'overlay-very different', 'dress-more casual', '2p- fine']"
16079,Looooove!!,"I normally don't write reviews for clothing but this dress warrants an exception.

i am a little over six months pregnant and have a shotgun wedding at city hall in a couple of weeks. with a limited amount of time to plan, i bought a bunch of pregnant wedding dresses online and rented the runway, to arrive just before the actual ceremony. out of curiosity, i walked into retailer today to see if they had any white or ivory dresses that would look cute and city hall wedding-ish. they did! so i too",[]
16080,I liked it but didn't keep,"I love all of these dresses, ordered the ivory in 00p on accident, meant to order 0p. was too small, but 0p would have fit. it is flattering, the pattern of lace is great, but i didn't like the color as much in person. i think i would like the blue better.","['0p-too small', 'pattern- flattering']"
16082,Surprised by other comments about size/bust,"5""5', 130, 32dd. i saw this dress online and thought it was beautiful, but considered not buying it because of other comments that the bust was too small for women with more curves. fortunately, the lovely blue dress was in my local retailer store and i decided to try it on in a size 4. i think the dress fits perfectly and i have gotten many compliments, including from random strangers. i have had no problem with a tight zipper or a low back, which is perfectly able to cover my bra in the back. th","['bust-not other', 'dress-fortunately blue', 'dress-perfectly many']"
16083,Small in bust,I ordered this dress in the blue color. it is lovely in person - but the petite seemed to run smaller than most petite dresses i buy from retailer. i ordered a 2p - and it was tight in the bust on me. i imagine a 4p would be perfect. i am 117 5'3 34b.,"['petite- lovely', '4p- perfect']"
16085,This is a gorgeous dress. the blue is beautiful,"The fitted top and flared skirt are really nice on this piece. i am 5'6"" 125lb and i took a 6. a 4 might have been ok, but i felt more comfortable in the 6, and it had a really nice fit.

the quality is good, but there were some areas that were starting to pull and the floral details come a little frayed around the cutout edges, so i'm not sure how it will wear.","['skirt- top', 'quality- good', 'areas- floral', 'details- little']"
16087,Beautiful dress!,"I specifically bought this dress for my bridal shower and loved it! i'm small on top and have hips that don't lie. i purchased the size 2 petite. the waist portion of the dress came up a little higher which was ok since it fell at a small part of my waist. the length was just above my knee, which i prefer. the dress has a nude lining which compliments my tan skin tone. i wore a regular nude bra that didn't show beneath the liner. i received many compliments and would highly recommend it. 

the","['portion- little', 'length-just knee']"
16090,Flattering but not for work,"This dress was as pretty in real life as the picture. flattering also. unfortunately it is definitely not appropriate for office work. even though it appears so in the picture, the back is very low cut and there is no way not for bra to show (unless you don't need one) also it was much tighter on top than the model picture, even though the rest fit perfectly.","['dress-pretty real', 'back-very low', 'way-much tighter']"
16096,Delicate and beautiful,"I've been looking for a dress to wear to wedding this summer, and this is it. the blue color is lovely and the lace overlay is feminine and pretty. i'm small busted (34aa) with an athletic lower body (think, 120-lb marathoner), and the flare of this dress is perfect. i ordered this in a 0 and a 0 petite. the petite size looked little-girl short; the regular size hit just at my knee and was much more sophisticated. the waistband also fell at a more flattering place in the regular dress. i'm on th","['color- blue', 'overlay- lovely', ""flare-i'm lower"", 'size- petite', 'size- regular', 'waistband-more flattering']"
16098,Runs small,"I ordered this dress to possibly wear to my wedding rehearsal dinner. i an adding this review to give some guidance on sizing. i am size 34a and own two other dresses by this designer in size 2. for this dress, however, i had to size up to a 4 in order to close the side zip. i'm 5'7"" and the dress hit me just above the knee. (in my opinion, it would have been more elegant if it was a little longer.) the color combo with the taupe and off white is unique, but wasn't particularly flattering on my",['combo- unique']
16100,Beautiful lace dress - size up,I love this dress's gentle blue lace. the silhouette is just as seen in the pictures. i found the dress tight in the chest and had to size up one size (6 to 8).,[]
16101,Awesome fit and texture,The dress looks even better in person. the fabric is very delicate though but worth the extra care it needs. the fit was perfect and the color is just as in the picture.,"['dress-even better', 'fabric-very delicate', 'fit- perfect']"
16104,"Great concept, poor execution","The dress at first glance is pretty, feminine, and a timeless shape. sadly the quality just isn't there.  i ordered online and was excited trying it on (dress fit true to size for me, all be it a little snug in the chest).  the zipper is super cheap, hard to get up or down on or off the hanger.  the appliqus are sewn onto a super flimsy netting, already coming detached without even having worn it.  i could see this dress catching on ""everything"" and tearing easily.  given the quality i'm return","['dress- first', 'dress-online true', 'zipper-super cheap']"
16107,Stunning,"This one is a beauty! my store is not carrying the white - they had a lovely blue (periwinkle-ish) that immediately caught my eye. the ivory model shot makes the details of the lace and top layer really pop - more so than the blue variety but both are stunning. the details and layers on this dress are lovely and intricate without feeling overly delicate. quality most definitely in line with the price. 

fit: 130lbs/34c/5'6"" high waist. i'm a 4 or 6 at retailer depending on the brand. in most mou","['one- beauty', 'store- white', 'shot- top', 'details- lovely']"
16108,Great idea poorly executed,"I wanted to love this dress, but it has too many flaws. first, the ""waistband"" falls right under the bust and the skirt flares out from there. not a flattering silhouette.. second, the fabric is a sickly yellow-beige netting that looks like burlap. third, i can't imagine what kind of bra you can wear under it. on the plus side, the fabric isn't scratchy.","['fabric-sickly yellow', 'fabric- plus']"
16112,Simply timeless and feminine,"I bough this dress in blue and i cannot tell you the compliments and the looks i get on the street! no kidding! this is a beautiful dress which has a very feminine/romantic quality to it. i bought size 4 and it sits perfectly on my waist i completely fell in love with that dress and especially with the lace work and the design. this is a classic piece, that is always going to be timeless in my opinion. no regret at all to have bought it!",[]
16114,Nice summer dress,"I knew the ivory color was online only so i tried the blue one for size and i couldn't believe how nice the blue one is. i ended up buying it. i purchased a size bigger because mine wasn't available but because of lace and side zip, it still doesn't look huge. if i find my size in another store i can always exchange, but i couldn't leave the dress behind.","['color-so blue', 'one- blue']"
16157,Not flattering,Didn't like the dress. look pregnant in it. this dress is going back.,[]
16160,Will get you noticed!,The first day i wore this dress to work i was amazed by how many people commented on it! i knew i liked it but apparently so does everyone else!,['people- many']
16165,Cute and comfy casual dress.,I like the red color and the border detail at the neckline. i'm not crazy about the way the zipper on the back is emphasized. i'd rather have a less visible zipper. overall it is a cute and comfortable dress. the fabric is soft and substantial and has a nice texture to it. the shape is basic so it can be dressed up or down.,"['fabric- soft', 'shape- basic']"
16167,Love this dress!,"I bought this dress in the red option. was a little concerned when i read other reviews that said it looked like a maternity dress, but it didn't look like that on me at all. it falls nicely and fits me well - i am 5 ft, 107 lbs - in size xs. love the details at the neckline and hem. will be looking out for other dresses by maeve!",[]
16168,Great dress for the right body type.,"There is so much i love about this dress. like many of the other reviewers i simply love the fabric. it's soft and comfy but has texture and interest at the same time. there's beautiful detail to it as well. the edging at the neckline and hemline are unfinished and beautifully so. having said all that, i like many other reviewers i just don't have the body type to pull it off. there wasn't one angle that didn't make me look even bigger than i am. the pleating in the front, while very cute, gave","['detail- beautiful', 'edging- unfinished', 'angle-even bigger', 'pleating-very cute']"
16169,Comfortable,"Very comfy with cotton and lots of stretch. can be dressed up or down. i wear it with blue denim jacket and also with cream cardi. 5'4"" 135# and the small is perfect.",[]
16170,Cute and modern,"I like this dress because it's the perfect shape on me and i think the design is modern and cute. i got the red and i really like the pattern and the subtle tulle edging. the material is a little stretchy and substantial and there's also a lining. i wore it with little booties like the model and tights and a cropped moto jacket and loved the outfit. i am short, small chest, but somewhat broad shouldered, the empire waist would not work on larger chested women with hourglass figures.","['design- perfect', 'material- little', 'lining- substantial', 'waist-somewhat broad']"
