,Title,Review Text,aspect-opinion
9822,Love this dress,"Flowy, comfy plaid dress perfect for the fall or winter. front is much shorter than the back - at 5'8"" the front is nearly too short on me, but works with a pair of tights. dress has a cami slip underneath, which is needed as the blue detailing across the chest and down the center is sheer, adding to how special the dress is. can be made more or less casual based on accessories and footwear!","['front-much shorter', 'front-too short', 'dress-underneath blue', 'center- sheer', 'dress- special']"
9823,Adorable dress but poor quality :(,"I just think this dress is so cute! i love it with booties! 
here are the fit details: i'm 5'4 1/2"" and the front of the dress hits just above my knees. (i was concerned that it would be too short for my lifestyle based on the photo). the sleeves roll up and have a tab to button, however the button is very low. therefore, the sleeve rolls up not mid arm, but actually about three inches above my wrist! (it's still super cute, just nowhere near my elbow. just letting you know).
final detail that","['dress-so cute', 'button-very low', 'sleeve-not mid']"
9827,Surpassed my expectations,"I really wasn't sure if this dress would work for me, so i was very excited when i fell in love with it! i haven't experienced any quality or tearing issues with it as one reviewer noted, thank goodness! i love the color scheme and versatility of this dress. i have worn it with tights, a belt and short-heeled ankle booties to make it a little more dressy. but i most love it with some funky jewelry and leggings, wearing it more tunic style. the slip underneath is a great feature as well! it does","['dress-really sure', 'reviewer-very excited', 'slip-underneath great']"
9831,Love this dress!,"This dress is so pretty on! i almost didn't try it on because on the hanger it didn't look like it would have any shape. well, it is super drapey and flowy, and it looks great on, almost swing style. it is doubled up on fabric, and with the longer sleeves i was scared it would make me too hot, but the fabric is light and breathable, it will be a perfect transitional dress for fall and early spring. fyi, the eyelet strip on the front and back are see through, didn't realize that the first time i","['fabric-too hot', 'strip-fyi first']"
9832,Beautiful fabric,"The colors and fabric on this dress are really pretty. the lace is a soft blue instead of white. i have other dresses like this from this brand and really wanted to keep it, but it runs larger than the others i have. also, it doesn't have pockets. if it fits you properly, i think you will love it!",['lace- soft']
9834,Maternity dress?,This was just not flattering for me--looked too much like a maternity dress. i can't really do a belted waist so perhaps that would make this dress more versatile for someone else. i was sorry to have to return because it goes well with sandals and boots!,[]
10156,Snags easily,"I'm 5'2 and bought the dress in a petite medium. i like to buy clothes that i can wear to work and this dress was almost too short. if it were any shorter, it wouldn't have worked. if i were to buy it again, i'd probably go with a non-petite size. also, i ordered the dress online and i found two snags in it as soon as i pulled it out of the box. i don't think they will be terribly noticeable, but just beware that this dress will apparently snag easily. i plan to wear it with a purse without meta","['dress-too short', 'dress-terribly noticeable']"
10163,Too boxy but nice idea,"This dress did not work well on my figure. i have a small waist and broad hips, and the dress (size m for 140 lbs, 5'8"") was too boxy. i didn't have objections to the fabric, like other reviewers - honestly, even if there were a snag or two, the fabric is kind of rustic and i don't think a snag would look terrible, depending on where it is. i should note that one of the ornamental buttons immediately fell off the dress upon arrival. my friend got the same dress in a size s and it worked better f","['dress- broad', 'snag- other', 'fabric- rustic', 'snag- terrible', 'friend- same']"
10165,Beautiful and classy,Wore this dress for easter dinner and received many compliments. it is delicate and if not careful the diamond pattern can snag. i loved the comfort and ability to dress up or down. i ordered the regular instead of petite as i wanted the length at my knees not thigh high. and it fit perfect at 5'4.,['pattern- careful']
10167,Classic design with drawbacks,"I ordered this dress in two sizes, pxs and ps. they both arrived in a timely manner but the pxs was snagged upon arrival. there were a few other reviewers that stated the dress snagged easily but i loved the classic look of this dress so i thought i would take the chance. unfortunately i had to take both back to the store because the potential for snagging the fabric was too high even considering the sale price. also, the dress comes with a cotton slip but the slip for the pxs was tiny while the","['reviewers- other', 'dress-easily classic', 'potential-too high', 'slip-also tiny']"
10169,Big blue sack,"This dress hangs like a sack. it really needs a belt to give it some shape. i tried to style it with one, but then didn't look right either. i did like the slip that came with it. i'll be returning it.",[]
10174,So cute but quality not good,"This dress is so cute and so flattering. i loved the shape, but i wore it wonce and the fabric was pulling on everything! just holding a purse while walking managed to pull out a ton of the fabric! when you spend so much money on something you think the quality would be better..","['dress-so cute', 'fabric-so much', 'quality- better']"
10177,Petite and busty- avoid,"I wanted to like this so much. it's a great good girl dress, church dress. however, it makes no sense. it's a summer dress with massively thick lining that snags i'm petite and busty and it made me look and feel very wide.",[]
10239,Even better in person!,I'm 5' 120 and the 4p fit like a glove. i have a bigger chest and there is no pulling on the buttons. the colors and fit on the dress are perfect. i had so many compliments when i wore it!,"['pulling- bigger', 'colors- perfect']"
10243,Love this dress,"So cute, so comfortable, so pretty - so i guess i love everything about it. it is not too short on me and i think you can wear it in many ways... thought of adding a vest - thought of boots - can't wait to wear it. i agree the material is substantial so it isn't flimsy for fall or winter. happy with this purchase. runs true to size. i went with the op. i sometimes chose regular length, but this one is just right in the petite. i have long arms but these sleeves are just right. i am 5 ft. tall, b","['material- substantial', 'one-sometimes regular', 'sleeves- long']"
10245,Pretty and sturdy,"I like the make of this dress, the fabric is thick and light at the same time.
the cut is loose and flattering. the different patterns are also very fun. colors are gorgeous, nice details. the buttons are sturdy. 
i tried on both 0p and 00p - not much difference in the 2 (i would go petite if you are on the short side). the 00p was just a bit snugger near the =chest, but didn't gape. the waist is definitely meant to be looser, so don't expect a fitted dress. length was slightly above the knee","['fabric- thick', 'cut- loose', 'patterns- different', 'colors- gorgeous', 'buttons- sturdy', '00p-just snugger', 'length-slightly knee']"
10251,Awe love!,"Oh my! this dress fits wonderfully on! so ready for autumn! i have a big bust, this dress does not split at the buttons.","['dress-so ready', 'dress- big']"
10264,Darling dress!,"I stumbled upon this dress yesterday at the store and fell in love with it! i wore it today with boots and received tons of compliments. it is light, comfortable and flattering. i love that it is machine washable, too!",[]
10267,Lovely dress!,"I loved this dress when i saw it online! i could not wait until i see in one of the local stores.  i bought it today! unlike other reviews, i think this dress runs large. i am a 4 and bought the zero. maeve tends to run large on me. i would suggest that you try a size smaller. it looks very flattering!","['dress- other', 'maeve- large']"
10268,My new favorite dress!!,"This dress rules.  so comfy, and versatile.  flattering cut.  great with flats, wedges, booties, boots with tights.  easily my new fav.  runs large.  i am usually a 6/8 and the 4 was perfect after i steamed it.  no button gap either, i am a 34c.",[]
10269,There should be more !,Loved it! i am curvy and it is very hard to find a dress that looks easy and at the same time shapes you. the various cuts of the different prints are placed in the right place in the body . easy dress and beautiful. there should be more dresses in this style in different color combos.,['dresses- more']
10330,On my wish list,"I tried this on in the store, in regular size (i often need petite). i think on this one, i could go either way.

the cut is flattering fit and flare, and the colors are rich. i like the ""flowery"" design, good spring piece in my opinion, as it has components of all kinds of seasons: sleeveless and see-though material, buthe design part is almost like a fine corduroy, very soft. not too flimsy iether.","['cut- flattering', 'colors- rich', 'part- see-though']"
10336,Very cute dress,"The dress is very cute, probably more on the casual side. i ordered the 2 petite and it hits me a few inches above the knee, which is what i wanted. the material of the dress and under slip is a little thin, but it looked nice after i ironed it. the top part of the dress looks great and shows off my shoulders nicely.","['dress-very cute', 'material- little', 'part- top']"
10350,Perfect!,This dress is super flattering. i love everything about it!,['dress-super flattering']
10352,Better in person!,"The print and detail on this dress are so much better in person, especially the neckline! i agree with the previous reviewer in that it felt spring-timey to me. flattering fit and flare however the top runs extremely small. i am usually a 6 in retailer dresses and i could barely zip the 8 over my bust but the 10 was enormous. rest of the dress fit fine but if you are large up top you might want to size up. fabric does not stretch. overall too cute to pass up! for reference i am a 34dd.","['print-much better', 'top- flattering', 'rest- fine']"
10353,"Versatile, great spring & winter color","Color of the dress matches color on my monitor. the neckline is sheer. i am 5'4"" ,125 lbs, 32d and ordered a size 6. i thought it fit perfect. this is a great spring/summer dress and can be worn with dress heels or flats for a dressier look. it can also be worm with tennis shoes (white converse are my choice) for a more casual look.

i think this dress could also transition to a fall/winter piece paired with tights and a suit jacket or cardigan. 

also, i love the pockets, though i do see ho","['neckline- sheer', 'converse-also white']"
10356,My new favorite dress,"This dress fits me perfect. the only complaint i have is that it was a little snug around the neck every now and then. it was a little snug getting in and out of the dress too. overall, the design is beautiful and it is definitely my new favorite.","['dress- perfect', 'complaint- only', 'design-overall beautiful']"
10361,Kentucky derby dress,Really love the print of this dress and the eyelet detailing around the neck! very flattering!,[]
10759,Wish it had a little more shape,"A cute dress. i did not have the issue with the slip being too tight. i wish it had a little more shape to it. while flowy, it looks a tiny bit tent-like. i still like it and wear it into fall with booties and boots!",[]
10760,Flowy blue,Really comfortable dress to wear.  pretty flower design.  good fabric and ribbon details are well placed. thankful it came with a cotton under slip because it's very sheer fabric and i didn't have to think of  what to put underneath.  have worn it twice since it shipped and i'm really happy with my purchase.  online order and shipment was super fast too.,['order- online']
10764,Love this dress,I purchased a petite size which fit great except for the slip. the slip is at least 2 inches shorter than dress. super comfy and flattering! perfect for fall with at pair of booties.,['slip- least']
10765,"Great blue, slimming fit","I really like this dress. despite the somewhat gathered skirt, it has a clean line and doesn't add a lot of volume around the hips. the blue is a great color. the length is well above the knee but i'm 5'10"". i can see wearing this dress in the fall with leggings or tights and boots.","['blue- great', 'length-well knee']"
10766,Wanted to like it,"I have a holding horses dress similar to this one from about a year ago.  i loved the swinging fit without it looking like a maternity dress.   the fit and style of this dress is wonderful, it's the color that killed it for me.   i ordered the ""orange"" because i liked the photo on the model.  when the dress arrived in the mail, i could hardly take it out of the package and try it on.   the color is almost neon orange.   too much for this redhead.  hard to wear that bright neony color.  not sure","['fit- wonderful', 'color-almost neon']"
10767,Didn't work,"This dress ran small in the arms for me. when i returned it for a bigger size, the dress i got had a huge rip in the decorative threading on the back. i can't believe the product wasn't checked for flaws this huge before shipping. i asked for another one in the same size. we'll see if it, too, is defective","['dress- small', 'dress- bigger']"
10770,Had to return,"I loved this dress and it fit perfectly. i did not have any issue with the camisole being tight, and i am really curvy. i did however have a problem trying to take it off. it has no zipper and in order for me to get it over my head i had to stretch my shoulders to the point where i ripped the back. i went to the store and tried on the larger size and ripped that one too. i tried to take it off more delicately but i couldn't. maybe it was me, but this dress is too much hassle. if i went any highe",['dress-too much']
10773,Great dress,This dress is great. wear now and into fall with boots and leggings. it seems to have structure with the seams and is nicley flowy.,['dress- great']
10775,Pretty dress,Very pretty dress but the fit is not great. i have to get help to take it off because it's tight in the shoulders.,['fit-Very pretty']
10785,Cute dress but terrible design flaw,"I purchased this dress yesterday and it's cute and fits great, but the embroidery across the back ripped as soon as i moved my arms. it's really delicate and strains anytime you lift your arms overhead or forward. i'm keeping it anyway because the supersoft pretty slip that come with it is worth the sale price.","['embroidery- great', 'slip-anyway pretty']"
10786,Good fall dress,Nice dress to wear while seasons are transitioning,['seasons- Nice']
10787,Little doll on the prarie,"Loved this dress online, but my small pettie stature made me looks like an orphan from the prairie.",['stature-online pettie']
10788,Recommend this product!,"I got this online in a sale and couldn't wait to try it on at home! it's so cute, the fabric is a great print and the fit is swingy, which i love. i have a larger bust than waist and i'm 5'8"", 160 lbs. i ordered my normal size 10 and it fit perfectly. i can't wait to wear it with booties this fall!","['fabric-so cute', 'fit- great']"
10789,"Pretty colors, poor fit","I loved the colors on this dress, but i don't like the way it fits. it is tight around the shoulders, but the rest of the dress is really big and has no shape",['rest- tight']
10793,Where is the slip!?,"Was excited to receive this dress as i got it at a great price on sale. the colors are great and it fits pretty good, but it came without a slip!!  so disappointing to not receive the entire dress!!  hence the 2 stars. may send it back for this reason.",['colors- great']
10794,"Voluminous, flow-y material but falls just right","I am usually an xsp or 0p but i ordered up one size (2p) due to previous reviews complaining about the tight slip. however i definitely did not need to size up. the slip is fine and the outer 'shell' is billowy and i should have stuck with my usual size! when i put it on i was not in love due to the dress being so roomy, but a second check in the mirror showed that the fabric / seams draped well and it overall looked pretty cute. it hits about 2 inches above my knees and therefore seems pretty p","['slip- fine', 'shell- outer', 'check-so second', 'fabric-pretty cute']"
10797,Cute dress,This is a nice flowy dress that i plan to wear in the fall with long boots. i love how light it feels.,[]
10799,Perfect fall dress,Dress is true to size. has a built in liner with thin straps so it is not see through. really cute on.,['Dress- true']
10800,My new fave!,Most comfortable and great looking! i got complements from everyone! literally!,[]
10803,Too billowy,I really loved this in the catalog. the fabric and details are very pretty. however it's a lot of fabric without much form. my husband suggested it for maternity (not realizing it has fitted slip). not for curvy/ hourglass.  had to send it back.,[]
10807,Cute casual dress,Cute dress to throw on and go. fits pretty true to size except for the slip underneath. it's a little tight and i felt to short for the dress. i ended up wearing a full slip i had under it and that work great!,[]
10808,Very roomy,"I ordered this dress is in the yellow/orange. the colors are pretty, the pink detail is nice and that's about it. the slip underneath is a form fitting yellow cotton - no big deal. the dress itself runs very large and in an unflattering way. if i was pregnant, it was perfect. the material feels cheap to me and this, along with the roomy fit - is why this dress will be returned.","['colors-pretty pink', 'detail- nice', 'slip-underneath form', 'dress-very large', 'material- cheap']"
10812,Great dress!,"I bought this dress for fall and will get a lot of wear out of it! the fit is perfect - loose, but structured. plan to pair with booties over the coming months!",['fit- perfect']
10813,Cute and comfortable peasant dress,"I sized up on this one and i'm glad i did. the slip for this dress is very small and in my normal size i doubt it would've have even covered what needs to be covered for a dress like this too work. other than that, this swing dress is adorable, work appropriate and the pattern is sweet. even though i ordered a 12, instead of my usually 10, the sleeves were a bit constricting, but hit at the right spot. i see myself throwing this easy little number on a lot.","['slip-very small', 'dress- other', 'pattern- appropriate', 'sleeves-usually right']"
10815,Great dress!,"Nice loose-fitting dress to wear in the summer and to transition into the fall. i had no problem with the slip being too tight. 5'3'', 118lbs, and went with my normal size 2. it was loose through the body but sizing down would have made the dress too tight on my shoulders. it's great with boots or flats!",['sizing- loose']
10816,Great but not for me.,The dress is adorable and has a very nice fabric and a slip that goes underneath. it was just too big for me even as a swing dress.,['dress- adorable']
10835,Great vintage pattern but what were they thinking,"Oh such a classic retailer look for summer! a vintage pattern on a crisp cotton fabric. i was immediately drawn to it. but wait- there is a sort of wrap around tie at the waist, creating the look of an apron. yes. it looks like one is wearing a full apron. or scrub dress. 
why?? this would have been sooo much better as a simple shift or a skirt/blouse combo.",['retailer- classic']
10837,More cons than pros,"The material is adorable and if it was available in a blouse with sleeves, i would buy in a minute. we have a pool and i thought it would be cute to wear while entertaining. now the cons, i am long waisted and this strange tie knotted high under the bustline giving an odd lumpy look. it runs short and i can't imagine who thought this design was a good idea. there were no reviews when i ordered. i am learning to try it on in the store and/or read the reviews before investing. i would say go up a","['material- adorable', 'design- short']"
10844,"Cute, lots of fabric","I tried the regular szie in store, like the cut, need petite though (too long and a lot of fabric) - i am 5'1.5"" and 115lbs... color, unfortunatly, looke aweful on my skin tone and washed me out. would need to be more red, the striping washed out the color nad dind't look flattering on me. the cut did, however.

so, if you ahge a good hur to your skin, good dress for you, if you are palelike me, i don't recommend...

ps love hte tie waist. picture not asflattering as on person.","['color-unfortunatly aweful', 'striping-more red', ""dind't- flattering"", 'dress-so good']"
10846,Great dress for summer,"This dress is gorgeous. i took the advice of a previous reviewer and tried one size down, it fit perfectly. i am usually between a 10 or 8 in retailer dresses depending on the cut, the size 8 in this was great. i am near the small chested side a 36b and there was still plenty of room in the top. the swimmers on the dress are embroidered and i didn't really notice until i saw the inside. beautiful detail. the dress is a lightweight cotton and great for warm weather. its even more flattering to be a","['dress- gorgeous', 'size-usually great', 'plenty- chested', 'dress- lightweight']"
10849,"Beautiful dress, just not for me","This dress is really gorgeous, really fun and beautifully made. i'm typically an 8petite (140lbs, 5'4"", 34dd) so i got this in an 8 and it was huge on me. there was so much extra room in the chest and the back and it was much too long for me. even if i sized down, it feels a little age inappropriate for me. i'm 21, and it felt very conservative and unflattering.  i think this dress is excellent, just not for me.","['dress-really gorgeous', 'room-much extra', 'dress- excellent']"
10851,"Beautiful dress, terrible zipper","I loved the look of the dress. it's a very flattering design. however, i absolutely hate the side zipper. every time i have worn it, the zipper will get stuck and it is a struggle to get it up. the side tie is a very cute touch, but you definitely have to figure out the best way to tie it, so you don't have a huge bump of fabric on your back. having said all this, i still did get a lot of compliments from this dress. i do wish the dress had a lining.","['zipper- stuck', 'tie-very cute']"
10852,The most darling little dress!,"I bought this dress as soon as i received the retailer catalogue. i rushed to the store because i absolutely fell in love with it. when i tried it on, i went a complete size down. i'm usually an 8, but i snagged this beauty in a 6. the top part really does run larger, so unless you have really broad shoulders, you'll need to size down. the sleeves hit my arms at a nice place, and the little tie in the front is awesome, because not only is it an interesting detail, it can be loosened or tightened d","['part- top', 'sleeves- nice', 'tie- little']"
10856,Adorable!!!,"Ok...so after reading the other reviews, i'm sad to say i rated this as ""runs small"" only because i usually buy one or two sizes smaller in maeve than i settled on with this dress. it's actually an adorable dress but i'm sure you have to have the right figure. i don't think any one woman has the same figure as another and this dress is made for someone with a very definite hourglass figure. i have a large chest, a moderate middle and large hips. i really loved both sizes but i chose to size up b",['woman- same']
10858,Cute summer dress,Really cute fun print. nice summer dress..,[]
10859,"Pretty print, strange fit","Totally bummed. the pretty print doesn't outweigh the very odd fit of this dress. makes you look really top heavy and even the print, which looks so cute online, looks muddled in person. sadly, went right back.",['print- pretty']
10861,Fun day dress,"I have to agree with another poster who was dissapointed about the dress not being lined....i mean, any dress over $50 should at least be lined! but, overall this is an adorable dress, very flattering and so fun for summer! if it were lined i would have purchased, but that's all personal preference as i cannot stand having to wear a slip!",[]
10866,Cute dress,"This dress is cute and i will wear it to work. i only decided to keep it because i got the sale price and an additional 40 percent off. the print is cute, but a little bit odd, it's a swimmer in a cap. the tie is fun.","['dress- cute', 'print- cute', 'tie- fun']"
10869,Charming and delightful!,"This dress is the opitome of summer! day or night, running errands during the day to a casual night out this dress will be that go to favorite. i feel it runs small on the top, i am large busted and i sized up for this reason and it still could be roomier...i wear a size 10 on top and for referance i got the 12. i will keep it as it is not uncomfortable but for a drees that lends to a drape on top i wish they would have made it roomier....imhave never had this issue with mauve as it is one of my","['dress- opitome', 'dress- casual']"
